C-634/21,2023-12-07,FIRST,1,A. Arabadjiev;T. von Danwitz;P.G. Xuereb;A. Kumin;I. Ziemele,5,A. Kumin,P. Pikamäe,1,40;41;42;43;44;45;46;47;48;49;50;51;52;53;54;55;56;57;58;59;60;61;62;63;64;65;66;67;68;69;70;71;72;73,34,Credit scoring by a credit information agency constitutes automated individual decision-making under Article 22(1) GDPR when a third party relies strongly on that score for contractual decisions.,Article 22(1);Article 22(2);Article 22(3);Article 22(4);Article 4(4);Article 5;Article 6;Article 13(2)(f);Article 14(2)(g);Article 15(1)(h),4;5;6;13;14;15;22,AUTOMATED_DECISION_MAKING,,1,"The applicability of that provision is therefore subject to three cumulative conditions, namely, first, that there must be a 'decision', secondly, that that decision must be 'based solely on automated processing, including profiling', and, thirdly, that it must produce 'legal effects concerning [the interested party]' or 'similarly significantly [affect] him or her'.",1,"The concept of 'decision' within the meaning of Article 22(1) of the GDPR is thus, as the Advocate General noted in point 38 of his Opinion, capable of including a number of acts which may affect the data subject in many ways, since that concept is broad enough to encompass the result of calculating a person's creditworthiness in the form of a probability value concerning that person's ability to meet payment commitments in the future.",1,"Those enhanced requirements as to the lawfulness of automated decision-making and the additional information obligations of the controller and the related additional rights of access of the data subject are explained by the purpose pursued by Article 22 of the GDPR, consisting of protecting individuals against the particular risks to their rights and freedoms represented by the automated processing of personal data, including profiling.",HIGH_LEVEL_OF_PROTECTION;FUNDAMENTAL_RIGHTS;EFFECTIVE_ENFORCEMENT,,TELEOLOGICAL,1,1,1,C-702/20;C-17/21;C-579/21;C-26/22;C-64/22;C-77/21;C-582/14,7,1,MIXED,1,PRO_DATA_SUBJECT,"Broad interpretation of automated decision-making extends Article 22 protections to credit scoring, expanding data subject rights and controller obligations.",0,NONE,0,NONE,0,,NONE,1,PRO_DATA_SUBJECT,2023,0.0,FIRST,RIGHTS,0,0,1,1.0,3,3,0,0,0,1,1,1,0,0,1,0,0,0,0,1,1,0,0,0,0,0
C-638/23,2025-02-27,EIGHTH,1,N. Jääskinen;M. Gavalec;N. Piçarra,3,M. Gavalec,M. Campos Sánchez-Bordona,1,23;24;25;26;27;28;29;30;31;32;33;34;35;36;37;38;39;40;41;42;43;44;45;46;47;48;49,27,National law may designate an auxiliary administrative entity without legal personality as controller if it can fulfil controller obligations and the law determines the scope of processing.,Article 4(7);Article 5(2);Article 6(1)(c);Article 6(1)(e);Article 6(3),4;5;6,CONTROLLER_DEFINITION,MEMBER_STATE_DISCRETION,1,"As a preliminary point, it must be recalled that, under Article 4(7) of the GDPR, the concept of 'controller' covers natural or legal persons, public authorities, agencies or other bodies which, alone or jointly with others, determine the purposes and means of the processing of personal data.",1,"That provision also states that, where the purposes and means of such processing are determined, inter alia, by the law of a Member State, the controller may be nominated or the specific criteria for its nomination may be provided for by that law.",1,"It is apparent from the case-law of the Court that that provision is intended to ensure, through a broad definition of the concept of 'controller', effective and complete protection of data subjects.",HIGH_LEVEL_OF_PROTECTION;LEGAL_CERTAINTY,,TELEOLOGICAL,1,1,1,C-683/21;C-807/21;C-604/22;C-231/22,4,1,CASE_LAW_BASED,0,MIXED,Allows entities without legal personality to be controllers (pro-controller flexibility) but requires them to fulfill all controller obligations toward data subjects (pro-data subject protection).,0,NONE,0,NONE,0,,NONE,0,INDETERMINATE,2025,2.0,OTHER,ACTORS,0,0,1,1.0,3,3,0,0,0,1,0,0,0,0,1,0,0,0,0,1,1,0,0,0,0,1
C-645/19,2021-06-15,GRAND_CHAMBER,5,K. Lenaerts;R. Silva de Lapuerta;A. Arabadjiev;A. Prechal;M. Vilaras;M. Ilešič;N. Wahl;E. Juhász;D. Šváby;S. Rodin;F. Biltgen;K. Jürimäe;C. Lycourgos;P.G. Xuereb;L.S. Rossi,15,L.S. Rossi,M. Bobek,1,43;44;45;46;47;48;49;50;51;52;53;54;55;56;57;58;59;60;61;62;63;64;65;66;67;68;69;70;71;72;73;74;75,33,A non-lead supervisory authority may initiate legal proceedings regarding cross-border processing only in specific situations where GDPR confers decision-making competence on it.,Article 55(1);Article 56(1);Article 56(2);Article 58(5);Article 60;Article 61;Article 62;Article 63;Article 64;Article 65;Article 66,55;56;58;60;61;62;63;64;65;66,ONE_STOP_SHOP,DPA_POWERS,1,"Article 55(1) of Regulation 2016/679 states the general rule that each supervisory authority is to be competent for the performance of the tasks assigned to it and the exercise of the powers conferred on it, in accordance with that regulation, on the territory of its own Member State.",1,"It follows more specifically from Articles 56 and 60 of Regulation 2016/679 that, with respect to 'cross-border processing', within the meaning of Article 4, point (23), of that regulation, and subject to Article 56(2) thereof, the various national supervisory authorities concerned must cooperate, in accordance with the procedure laid down in those provisions, in order to reach a consensus and a single decision, which is binding on all those authorities.",1,"Regulation 2016/679 requires the European Union institutions, bodies, offices and agencies, and the competent authorities of the Member States, to ensure a high level of protection of the rights guaranteed in Article 16 TFEU and Article 8 of the Charter.",HIGH_LEVEL_OF_PROTECTION;HARMONIZATION;FUNDAMENTAL_RIGHTS,,SYSTEMATIC,1,1,1,C-311/18;C-210/16;C-507/17,3,1,RULE_BASED,0,MIXED,Allows non-lead DPA to bring proceedings in limited circumstances but confirms one-stop-shop constraints on enforcement powers.,0,NONE,0,NONE,0,,NONE,0,INDETERMINATE,2021,-2.0,GRAND_CHAMBER,ENFORCEMENT,0,1,5,0.2,3,3,0,0,0,1,1,0,1,0,1,0,0,0,0,1,0,1,0,0,1,0
C-645/19,2021-06-15,GRAND_CHAMBER,5,K. Lenaerts;R. Silva de Lapuerta;A. Arabadjiev;A. Prechal;M. Vilaras;M. Ilešič;N. Wahl;E. Juhász;D. Šváby;S. Rodin;F. Biltgen;K. Jürimäe;C. Lycourgos;P.G. Xuereb;L.S. Rossi,15,L.S. Rossi,M. Bobek,2,76;77;78;79;80;81;82;83;84,9,A non-lead supervisory authority may bring legal proceedings without requiring the controller to have an establishment in that authority's Member State.,Article 3(1);Article 4(16);Article 55(1);Article 58(5),3;4;55;58,DPA_POWERS,SCOPE_TERRITORIAL,1,Article 58(5) of Regulation 2016/679 is worded in general terms and that the EU legislature has not specified that the exercise of that power by a Member State's supervisory authority is subject to the condition that its legal action should be brought against a controller who has a 'main establishment'.,1,"Article 3(1) of Regulation 2016/679, which governs the territorial scope of that regulation, provides, in that regard, that the regulation applies to the processing of personal data in the context of the activities of an establishment of a controller or a processor in the European Union, whether or not the processing takes place in the European Union.",0,,,,SEMANTIC,1,1,0,,0,0,RULE_BASED,0,PRO_DATA_SUBJECT,Expands DPA enforcement capacity by removing establishment requirement as precondition for legal action in cross-border cases.,0,NONE,0,NONE,0,,NONE,1,PRO_DATA_SUBJECT,2021,-2.0,GRAND_CHAMBER,ENFORCEMENT,0,1,5,0.2,2,1,0,0,0,0,0,0,0,0,0,0,0,0,0,0,0,0,1,0,1,0
C-645/19,2021-06-15,GRAND_CHAMBER,5,K. Lenaerts;R. Silva de Lapuerta;A. Arabadjiev;A. Prechal;M. Vilaras;M. Ilešič;N. Wahl;E. Juhász;D. Šváby;S. Rodin;F. Biltgen;K. Jürimäe;C. Lycourgos;P.G. Xuereb;L.S. Rossi,15,L.S. Rossi,M. Bobek,3,85;86;87;88;89;90;91;92;93;94;95;96,12,A non-lead supervisory authority may bring proceedings against any establishment of a controller if processing occurs in context of that establishment's activities.,Article 3(1);Article 55;Article 56;Article 58(5),3;55;56;58,DPA_POWERS,SCOPE_TERRITORIAL,1,That provision does not restrict the exercise of the power to initiate or engage in legal proceedings in such a way that those proceedings can solely be brought against a 'main establishment' or against some other 'establishment' of the controller.,1,"Article 3(1) of that regulation provides that it is applicable to the processing of personal data 'in the context of the activities of an establishment of a controller or a processor in the Union, regardless of whether the processing takes place in the Union or not'.",1,"Having regard to the objective pursued by Regulation 2016/679, which is to ensure effective protection of the freedoms and fundamental rights of individuals, in particular, their right to protection of privacy and the protection of personal data, the condition that the processing of personal data must be carried out 'in the context of the activities' of the establishment concerned, cannot be interpreted restrictively.",HIGH_LEVEL_OF_PROTECTION;FUNDAMENTAL_RIGHTS,,TELEOLOGICAL,1,1,1,C-210/16,1,0,RULE_BASED,0,PRO_DATA_SUBJECT,Broad interpretation of establishment activities allows DPA enforcement against local establishments even when main establishment is elsewhere.,0,NONE,0,NONE,0,,NONE,1,PRO_DATA_SUBJECT,2021,-2.0,GRAND_CHAMBER,ENFORCEMENT,0,1,5,0.2,3,2,0,0,0,1,1,0,0,0,1,0,0,0,0,1,1,0,0,0,1,0
C-645/19,2021-06-15,GRAND_CHAMBER,5,K. Lenaerts;R. Silva de Lapuerta;A. Arabadjiev;A. Prechal;M. Vilaras;M. Ilešič;N. Wahl;E. Juhász;D. Šváby;S. Rodin;F. Biltgen;K. Jürimäe;C. Lycourgos;P.G. Xuereb;L.S. Rossi,15,L.S. Rossi,M. Bobek,4,97;98;99;100;101;102;103;104;105,9,Legal proceedings commenced before GDPR application may continue under prior Directive for pre-existing infringements and under GDPR for subsequent ones.,Article 56(1);Article 58(5);Article 99,56;58;99,DPA_POWERS,OTHER,1,Regulation 2016/679 contains no transitional rule nor any other rule governing the status of court proceedings which were initiated before that regulation became applicable and which were still ongoing when it became applicable.,1,"In particular, there is no provision of that regulation which states that its effect is to bring to an end all court proceedings that are pending as at 25 May 2018 concerning alleged infringements of rules governing the processing of personal data laid down by Directive 95/46, even where the conduct that is a constituent element of such alleged infringements persists beyond that date.",0,,,,SEMANTIC,1,1,1,C-129/20,1,0,RULE_BASED,0,PRO_DATA_SUBJECT,Preserves DPA ability to continue enforcement proceedings spanning transition from Directive to GDPR without dismissal.,0,NONE,0,NONE,0,,NONE,1,PRO_DATA_SUBJECT,2021,-2.0,GRAND_CHAMBER,ENFORCEMENT,0,1,5,0.2,2,2,0,0,0,0,0,0,0,0,0,0,0,0,0,1,0,0,1,0,1,0
C-645/19,2021-06-15,GRAND_CHAMBER,5,K. Lenaerts;R. Silva de Lapuerta;A. Arabadjiev;A. Prechal;M. Vilaras;M. Ilešič;N. Wahl;E. Juhász;D. Šváby;S. Rodin;F. Biltgen;K. Jürimäe;C. Lycourgos;P.G. Xuereb;L.S. Rossi,15,L.S. Rossi,M. Bobek,5,106;107;108;109;110;111;112;113,8,"Article 58(5) has direct effect, allowing supervisory authorities to rely on it for legal proceedings even without national implementation.",Article 58(5);Article 288 TFEU,58,DPA_POWERS,,1,"Article 58(5) of Regulation 2016/679 states that each Member State is to provide by law that its supervisory authority is to have the power to bring infringements of this Regulation to the attention of the judicial authorities and where appropriate, to initiate or engage otherwise in legal proceedings, in order to enforce the provisions of that regulation.",1,"Under the second paragraph of Article 288 TFEU, a regulation is to be binding in its entirety and is to be directly applicable in all Member States, so that its provisions do not, as a general rule, require the adoption of any implementing measures by the Member States.",0,,,,SEMANTIC,1,1,1,C-528/15,1,0,RULE_BASED,0,PRO_DATA_SUBJECT,Strengthens DPA enforcement capacity by ensuring legal standing exists directly from GDPR regardless of national transposition.,0,NONE,0,NONE,0,,NONE,1,PRO_DATA_SUBJECT,2021,-2.0,GRAND_CHAMBER,ENFORCEMENT,0,1,5,0.2,2,2,0,0,0,0,0,0,0,0,0,0,0,0,0,1,0,0,1,0,1,0
C-65/23,2024-12-19,EIGHTH,2,N. Jääskinen;M. Gavalec;I. Ziemele,3,N. Jääskinen,L. Medina,1,34;35;36;37;38;39;40;41;42;43;44;45;46;47;48;49;50,17,"National rules adopted under Article 88(1) GDPR for employment data processing must also comply with the requirements of Articles 5, 6(1), and 9(1) and (2) GDPR.",Article 88(1);Article 88(2);Article 5;Article 6(1);Article 9(1);Article 9(2),88;5;6;9,MEMBER_STATE_DISCRETION,DATA_PROTECTION_PRINCIPLES;SPECIAL_CATEGORIES_CONDITIONS,1,"However, that wording does not provide any express indication as to whether the 'more specific rules' that the Member States thus have the possibility of adopting must seek to ensure compliance only with the requirements laid down in Article 88(2) of the GDPR or also with those of other provisions of that regulation, so that the processing of personal data carried out pursuant to such rules should also comply with those latter provisions.",1,"Article 88 of the GDPR appears in Chapter IX thereof, entitled 'Provisions relating to specific processing situations', while Articles 5, 6 and 9 of that regulation appear in Chapter II thereof, entitled 'Principles', which is therefore more general in scope.",1,"However, in order not to undermine all of those objectives, and in particular that of ensuring a high level of protection for employees where their personal data are processed in the employment context, Article 88 of the GDPR cannot be interpreted as meaning that the 'more specific rules' which the Member States have the option of adopting pursuant to that article could have the purpose or effect of circumventing the obligations of the controller or processor resulting from other provisions of that regulation.",HIGH_LEVEL_OF_PROTECTION;HARMONIZATION,,TELEOLOGICAL,1,1,1,C-34/21;C-268/21;C-757/22;C-667/21;C-21/23,5,0,CASE_LAW_BASED,0,PRO_DATA_SUBJECT,Limits Member State discretion by requiring full compliance with core GDPR data protection principles even when adopting specific employment rules.,1,REGULAR,0,NONE,0,,NONE,1,PRO_DATA_SUBJECT,2024,1.0,OTHER,OTHER,0,0,2,0.5,3,2,0,0,0,1,0,0,1,0,1,1,1,0,0,1,1,0,0,0,0,1
C-65/23,2024-12-19,EIGHTH,2,N. Jääskinen;M. Gavalec;I. Ziemele,3,N. Jääskinen,L. Medina,2,51;52;53;54;55;56;57;58;59;60,10,"National courts must conduct full judicial review of collective agreements to verify necessity of data processing, notwithstanding the parties' margin of discretion.",Article 88(1);Article 5;Article 6(1);Article 9(1);Article 9(2),88;5;6;9,MEMBER_STATE_DISCRETION,DATA_PROTECTION_PRINCIPLES,1,"By its second question, the referring court asks, in essence, whether Article 88(1) of the GDPR must be interpreted as meaning that, where a collective agreement falls within the scope of that provision, the margin of discretion that the parties to that agreement have to determine whether the processing of personal data is 'necessary', within the meaning of Article 5, Article 6(1) and Article 9(1) and (2) of that regulation, has the effect of preventing the national court from carrying out a full judicial review in that regard.",0,,1,"However, such an assessment process must not lead to those parties reaching compromises, on the basis of economic or practical considerations, which would be liable improperly to undermine the GDPR's objective of ensuring a high level of protection of employees' freedoms and fundamental rights with regard to the processing of their personal data.",HIGH_LEVEL_OF_PROTECTION;FUNDAMENTAL_RIGHTS,,TELEOLOGICAL,1,1,1,C-34/21,1,1,PRINCIPLE_BASED,1,PRO_DATA_SUBJECT,Ensures employees can challenge collective agreements that inadequately protect their data rights through full judicial review.,1,REGULAR,1,DATA_SUBJECT,0,,NONE,1,PRO_DATA_SUBJECT,2024,1.0,OTHER,OTHER,0,0,2,0.5,2,3,0,0,0,1,1,0,0,0,1,1,1,1,0,1,1,0,0,1,0,0
C-655/23,2025-09-04,FOURTH,4,I. Jarukaitis;N. Jääskinen;A. Arabadjiev;M. Condinanzi;R. Frendo,5,N. Jääskinen,M. Campos Sánchez-Bordona,1,36;37;38;39;40;41;42;43;44;45;46;47;48;49;50;51;52,17,"The GDPR does not provide a judicial remedy for data subjects to obtain preventive injunctions against future unlawful processing, but Member States may establish such remedies under national law.",Article 17;Article 18;Article 79;Article 84,17;18;79;84,REMEDIES_COMPENSATION,RIGHT_TO_ERASURE;MEMBER_STATE_DISCRETION,1,"It should be noted that the GDPR contains no provisions which provide, explicitly or implicitly, that the data subject enjoys, as envisaged by the referring court, a right to obtain, as a preventive measure and by means of judicial proceedings, an order that the controller of personal data refrain, in future, from committing an infringement of the provisions of that regulation.",1,"As a preliminary point, it must be borne in mind that, in interpreting a provision of EU law, it is necessary to consider not only its wording but also its context and the objectives pursued by the legislation of which it forms part.",1,"The possibility for the data subject to bring a legal action seeking an order requiring a controller to refrain, in future, from infringing the substantive provisions of the GDPR does not undermine those objectives but is, in fact, such as to enhance the effectiveness of those provisions and thus the high level of protection of data subjects with regard to the processing of their personal data, pursued by that regulation.",HIGH_LEVEL_OF_PROTECTION;EFFECTIVE_ENFORCEMENT,,SYSTEMATIC,1,1,1,C-21/23;C-659/22;C-507/23;C-710/23;C-530/23,5,1,MIXED,0,MIXED,"While not creating a new EU-level remedy, the ruling preserves Member State discretion to provide preventive remedies, neither expanding nor restricting existing rights.",0,NONE,0,NONE,0,,NONE,0,INDETERMINATE,2025,2.0,FOURTH,ENFORCEMENT,1,0,4,0.25,3,3,0,0,0,1,0,1,0,0,1,0,0,0,0,1,0,1,0,0,0,0
C-655/23,2025-09-04,FOURTH,4,I. Jarukaitis;N. Jääskinen;A. Arabadjiev;M. Condinanzi;R. Frendo,5,N. Jääskinen,M. Campos Sánchez-Bordona,2,53;54;55;56;57;58;59;60;61;62;63;64,12,"Non-material damage under Article 82(1) includes negative feelings such as fear or annoyance caused by loss of control over personal data, potential misuse, or reputational harm from unauthorized data transmission.",Article 82(1),82,REMEDIES_COMPENSATION,,1,It should be observed that Article 82(1) of the GDPR provides that any person who has suffered material or non-material damage as a result of an infringement of that regulation is entitled to receive compensation from the controller or processor for the damage suffered.,1,"In accordance with settled case-law, having regard to the absence of any reference in Article 82(1) of the GDPR to the domestic law of the Member States, the concept of 'non-material damage', within the meaning of that provision, must be given an autonomous and uniform definition specific to EU law.",1,"In addition, it is supported by the objective of that regulation, as set out in Article 1 and recitals 1 and 10 thereof, which is to ensure a high level of protection of natural persons with regard to the processing of personal data.",HIGH_LEVEL_OF_PROTECTION,,TELEOLOGICAL,1,1,1,C-687/21;C-200/23;C-300/21;C-590/22;C-456/22,5,1,CASE_LAW_BASED,0,PRO_DATA_SUBJECT,Broad interpretation of non-material damage to include negative feelings without requiring a severity threshold expands data subjects' ability to claim compensation.,0,NONE,0,NONE,0,,NONE,1,PRO_DATA_SUBJECT,2025,2.0,FOURTH,ENFORCEMENT,1,0,4,0.25,3,3,0,0,0,1,0,0,0,0,1,0,0,0,0,1,1,0,0,0,0,1
C-655/23,2025-09-04,FOURTH,4,I. Jarukaitis;N. Jääskinen;A. Arabadjiev;M. Condinanzi;R. Frendo,5,N. Jääskinen,M. Campos Sánchez-Bordona,3,65;66;67;68;69;70;71;72;73,9,The degree of fault on the part of the controller cannot be taken into account when assessing the amount of compensation for non-material damage under Article 82(1) GDPR.,Article 82(1);Article 83,82;83,REMEDIES_COMPENSATION,,1,"It is apparent from the case-law of the Court that, since the GDPR does not contain any provision intended to define the rules on the assessment of damages payable under the right to compensation enshrined in Article 82 of that regulation, national courts must, to that end, apply the domestic rules of each Member State.",1,"In contrast to what is provided for in Article 83 of the GDPR for administrative fines, the criteria for which are not applicable mutatis mutandis in the context of Article 82 of that regulation, the right to compensation provided for in Article 82, in particular in the case of non-material damage, fulfils an exclusively compensatory function.",1,"The Court has held that, in view of the compensatory function of the right to compensation under Article 82 of the GDPR, national courts are required to ensure 'full and effective' compensation for the damage suffered.",HIGH_LEVEL_OF_PROTECTION,,SYSTEMATIC,1,1,1,C-300/21;C-507/23;C-200/23,3,1,CASE_LAW_BASED,0,PRO_CONTROLLER,"Excluding degree of fault from damage assessment limits the amount controllers may have to pay, preventing punitive or enhanced damages based on culpability.",0,NONE,0,NONE,0,,NONE,0,PRO_CONTROLLER,2025,2.0,FOURTH,ENFORCEMENT,1,0,4,0.25,3,3,0,0,0,1,0,0,0,0,1,0,0,0,0,1,0,1,0,0,0,1
C-655/23,2025-09-04,FOURTH,4,I. Jarukaitis;N. Jääskinen;A. Arabadjiev;M. Condinanzi;R. Frendo,5,N. Jääskinen,M. Campos Sánchez-Bordona,4,74;75;76;77;78;79;80;81;82;83,10,Obtaining a prohibitory injunction under national law cannot reduce or replace the financial compensation for non-material damage payable under Article 82(1) GDPR.,Article 82(1),82,REMEDIES_COMPENSATION,,1,It is apparent from the case-law referred to in paragraphs 78 and 79 above that a form of compensation provided for by the applicable national law may be regarded as compatible with the GDPR only in so far as that form of compensation is in line with the principles of equivalence and effectiveness of EU law.,1,"In particular, compensation payable under Article 82 of that regulation cannot be awarded, in part or in full, in the form of a prohibitory injunction, since the right to compensation for damage provided for in Article 82 fulfils an exclusively compensatory function.",1,"In particular, it should be noted that the criteria for assessing the compensation payable in the context of actions intended to safeguard the rights which individuals derive from Article 82 of the GDPR, criteria which are prescribed within the legal system of each Member State, must ensure that the compensation for the damage suffered by the data subject as a result of an infringement of that regulation is full and effective.",HIGH_LEVEL_OF_PROTECTION;EFFECTIVE_ENFORCEMENT,,SYSTEMATIC,1,1,1,C-200/23;C-507/23,2,1,CASE_LAW_BASED,0,PRO_DATA_SUBJECT,Preventing reduction or substitution of financial compensation ensures data subjects receive full monetary redress regardless of other remedies obtained.,0,NONE,0,NONE,0,,NONE,1,PRO_DATA_SUBJECT,2025,2.0,FOURTH,ENFORCEMENT,1,0,4,0.25,3,3,0,0,0,1,0,1,0,0,1,0,0,0,0,1,0,1,0,0,0,1
C-659/22,2023-10-05,EIGHTH,1,M. Safjan;N. Piçarra;M. Gavalec,3,M. Gavalec,L. Medina,1,24;25;26;27;28;29;30;31;32;33,10,Verification of COVID-19 certificates using a mobile application constitutes processing of personal data within the meaning of Article 4(2) GDPR.,Article 4(2);Article 4(1);Article 2(1);Article 5;Article 6,4;2;5;6,SCOPE_MATERIAL,PERSONAL_DATA_SCOPE,1,"It is apparent from the wording of that provision, and in particular from the expression 'any operation', that the EU legislature intended the concept of 'processing' to have a broad meaning.",1,"The interpretation referred to in paragraph 30 of the present judgment is corroborated by Regulation 2021/953, which provides that the implementation of the EU Digital COVID Certificate constitutes processing within the meaning of Article 4(2) of the GDPR.",1,"That broad interpretation of 'personal data' and 'processing' is consistent with the objective of guaranteeing the effectiveness of the fundamental right of protection of natural persons with regard to the processing of personal data, referred to in recital 1 of the GDPR, which sets the tone for the application of that regulation.",HIGH_LEVEL_OF_PROTECTION;FUNDAMENTAL_RIGHTS,,SEMANTIC,1,1,1,C-175/20;C-439/19;C-60/22,3,0,RULE_BASED,0,PRO_DATA_SUBJECT,Broad interpretation of processing captures mobile app verification activities that might otherwise escape GDPR regulation.,0,NONE,0,NONE,0,,NONE,1,PRO_DATA_SUBJECT,2023,0.0,OTHER,SCOPE,0,0,1,1.0,3,2,0,0,0,1,1,0,0,0,1,0,0,0,0,1,0,0,1,0,1,0
