C-252/21,2023-07-04,GRAND_CHAMBER,8,K. Lenaerts;L. Bay Larsen;A. Prechal;K. Jürimäe;C. Lycourgos;M. Safjan;L.S. Rossi;D. Gratsias;M.L. Arastey Sahún;J.-C. Bonichot;S. Rodin;F. Biltgen;M. Gavalec;Z. Csehi;O. Spineanu-Matei,15,L.S. Rossi,A. Rantos,4,86;88;89;90;92;93;94;95;96;97;98;99;100;101;102;103;104;125,18,"Processing of off-platform data is necessary for contract performance only if objectively indispensable for a purpose integral to the contractual obligation, such that the contract's main subject matter cannot be achieved without it.",Article 6(1)(b),6,CONTRACT_BASIS,,1,"Under point (b) of the first subparagraph of Article 6(1) of the GDPR, that provision provides that processing of personal data is lawful if it is 'necessary for the performance of a contract to which the data subject is party or in order to take steps at the request of the data subject prior to entering into a contract'.",1,"The fact that such processing may be referred to in the contract or may be merely useful for the performance of the contract is, in itself, irrelevant in that regard.",1,The decisive factor for the purposes of applying the justification set out in point (b) of the first subparagraph of Article 6(1) of the GDPR is rather that the processing of personal data by the controller must be essential for the proper performance of the contract concluded between the controller and the data subject.,HIGH_LEVEL_OF_PROTECTION,,TELEOLOGICAL,1,1,1,C-439/19;C-175/20;C-184/20,3,0,RULE_BASED,0,PRO_DATA_SUBJECT,Strict interpretation of contract necessity prevents social networks from bundling unnecessary data processing into service contracts and claiming contractual basis.,1,STRICT,0,NONE,0,,NONE,1,PRO_DATA_SUBJECT,2023,0.0,GRAND_CHAMBER,LAWFULNESS,0,0,8,0.125,3,2,0,0,0,1,0,0,0,0,1,1,2,0,0,1,1,0,0,0,1,0
C-252/21,2023-07-04,GRAND_CHAMBER,8,K. Lenaerts;L. Bay Larsen;A. Prechal;K. Jürimäe;C. Lycourgos;M. Safjan;L.S. Rossi;D. Gratsias;M.L. Arastey Sahún;J.-C. Bonichot;S. Rodin;F. Biltgen;M. Gavalec;Z. Csehi;O. Spineanu-Matei,15,L.S. Rossi,A. Rantos,5,105;106;107;108;109;110;111;112;113;114;115;116;117;118;119;120;121;122;123;124;126,21,"Processing for legitimate interests requires informing users of the specific interest pursued, strict necessity, and a balancing test where users' interests and fundamental rights do not override the controller's legitimate interest.",Article 6(1)(f);Article 5(1)(c);Article 13(1)(d),6;5;13,LEGITIMATE_INTERESTS,DATA_PROTECTION_PRINCIPLES,1,"That provision provides that the processing of personal data is lawful only if it is 'necessary for the purposes of the legitimate interests pursued by the controller or by a third party, except where such interests are overridden by the interests or fundamental rights and freedoms of the data subject which require protection of personal data, in particular where the data subject is a child'.",1,The condition relating to the need for processing must be examined in conjunction with the 'data minimisation' principle enshrined in Article 5(1)(c) of the GDPR.,1,"In those circumstances, it must be held that the interests and fundamental rights of such a user override the interest of that operator in such personalised advertising by which it finances its activity, with the result that the processing by that operator for such purposes cannot fall within the scope of point (f) of the first subparagraph of Article 6(1) of the GDPR.",FUNDAMENTAL_RIGHTS;HIGH_LEVEL_OF_PROTECTION,,TELEOLOGICAL,1,1,1,C-597/19;C-439/19;C-708/18,3,1,CASE_LAW_BASED,0,PRO_DATA_SUBJECT,Users' fundamental rights and reasonable expectations override controller's advertising interests; extensive tracking creates a feeling of continuous surveillance that overrides commercial interests.,1,STRICT,1,DATA_SUBJECT,1,right to respect for private life;right to protection of personal data,DATA_PROTECTION,1,PRO_DATA_SUBJECT,2023,0.0,GRAND_CHAMBER,LAWFULNESS,0,0,8,0.125,3,3,0,0,0,1,1,0,0,0,1,1,2,1,0,1,1,0,0,0,0,1
C-252/21,2023-07-04,GRAND_CHAMBER,8,K. Lenaerts;L. Bay Larsen;A. Prechal;K. Jürimäe;C. Lycourgos;M. Safjan;L.S. Rossi;D. Gratsias;M.L. Arastey Sahún;J.-C. Bonichot;S. Rodin;F. Biltgen;M. Gavalec;Z. Csehi;O. Spineanu-Matei,15,L.S. Rossi,A. Rantos,6,127;128;129;130;131;132;138,7,"Processing for legal obligation compliance requires actual necessity pursuant to EU or Member State law meeting a public interest objective, proportionality to the legitimate aim, and strict necessity in the processing carried out.",Article 6(1)(c);Article 6(3),6,LEGAL_OBLIGATION_BASIS,,1,"Under point (c), processing of personal data is lawful if it is necessary for compliance with a legal obligation to which the controller is subject.",1,"Article 6(3) of the GDPR specifies, inter alia, in respect of those two situations in which processing is lawful, that the processing must be based on EU law or on Member State law to which the controller is subject.",1,That legal basis must meet an objective of public interest and be proportionate to the legitimate aim pursued.,LEGAL_CERTAINTY,,SYSTEMATIC,1,1,0,,0,0,RULE_BASED,0,NEUTRAL_OR_UNCLEAR,The holding provides interpretive guidance on the legal obligation basis without decisively expanding or limiting its scope.,1,STRICT,0,NONE,0,,NONE,0,INDETERMINATE,2023,0.0,GRAND_CHAMBER,LAWFULNESS,0,0,8,0.125,3,1,0,0,0,0,0,0,0,0,0,1,2,0,0,0,0,1,0,0,1,0
C-252/21,2023-07-04,GRAND_CHAMBER,8,K. Lenaerts;L. Bay Larsen;A. Prechal;K. Jürimäe;C. Lycourgos;M. Safjan;L.S. Rossi;D. Gratsias;M.L. Arastey Sahún;J.-C. Bonichot;S. Rodin;F. Biltgen;M. Gavalec;Z. Csehi;O. Spineanu-Matei,15,L.S. Rossi,A. Rantos,7,127;135;136;137;139,5,A social network operator cannot in principle rely on vital interests or public interest/official authority bases to justify off-platform data collection given its essentially commercial nature.,Article 6(1)(d);Article 6(1)(e),6,VITAL_INTERESTS_BASIS,PUBLIC_INTEREST_BASIS,1,That provision provides that the processing of personal data is lawful where it is necessary in order to protect the vital interests of the data subject or of another natural person.,1,"As can be seen from recital 46 of that regulation, that provision covers the specific situation in which the processing of personal data is necessary to protect an interest which is essential for the life of the data subject or that of another natural person.",1,"It follows from those examples and from the strict interpretation to be given to point (d) of the first subparagraph of Article 6(1) of the GDPR that, in view of the nature of the services provided by the operator of an online social network, such an operator, whose activity is essentially economic and commercial in nature, cannot rely on the protection of an interest which is essential for the life of its users or of another person in order to justify, absolutely and in a purely abstract and preventive manner, the lawfulness of data processing.",HIGH_LEVEL_OF_PROTECTION,,TELEOLOGICAL,1,1,0,,0,0,RULE_BASED,0,PRO_DATA_SUBJECT,Limiting commercial entities from invoking vital interests or public interest bases prevents abuse of these narrow exceptions by private platforms.,0,NONE,0,NONE,0,,NONE,1,PRO_DATA_SUBJECT,2023,0.0,GRAND_CHAMBER,LAWFULNESS,0,0,8,0.125,3,1,0,0,0,1,0,0,0,0,1,0,0,0,0,0,1,0,0,0,1,0
C-252/21,2023-07-04,GRAND_CHAMBER,8,K. Lenaerts;L. Bay Larsen;A. Prechal;K. Jürimäe;C. Lycourgos;M. Safjan;L.S. Rossi;D. Gratsias;M.L. Arastey Sahún;J.-C. Bonichot;S. Rodin;F. Biltgen;M. Gavalec;Z. Csehi;O. Spineanu-Matei,15,L.S. Rossi,A. Rantos,8,140;141;142;143;144;145;146;147;148;149;150;151;152;153;154,15,"A dominant position does not per se preclude valid consent, but is an important factor in assessing whether consent was freely given, particularly regarding imbalance of power and bundling of unnecessary processing.",Article 6(1)(a);Article 9(2)(a);Article 4(11);Article 7(1);Article 7(4),6;9;4;7,CONSENT_BASIS,,1,"Article 4(11) of the GDPR, for its part, defines 'consent' as meaning 'any freely given, specific, informed and unambiguous indication of the data subject's wishes by which he or she, by a statement or by a clear affirmative action, signifies agreement to the processing of personal data relating to him or her'.",1,"Article 7(4) of the GDPR provides that when assessing whether consent is freely given, utmost account must be taken of whether, inter alia, the performance of a contract, including the provision of a service, is conditional on consent to the processing of personal data that is not necessary for the performance of that contract.",1,"Such a circumstance must be taken into consideration in assessing whether the user of that network has validly and, in particular, freely given consent, since that circumstance is liable to affect the freedom of choice of that user, who might be unable to refuse or withdraw consent without detriment.",HIGH_LEVEL_OF_PROTECTION;FUNDAMENTAL_RIGHTS,,TELEOLOGICAL,1,1,0,,0,1,PRINCIPLE_BASED,0,MIXED,"Dominant position does not automatically invalidate consent (pro-controller), but must be considered as important factor affecting freedom of choice and requires option to refuse without detriment (pro-data subject).",0,NONE,1,DATA_SUBJECT,0,,NONE,0,INDETERMINATE,2023,0.0,GRAND_CHAMBER,LAWFULNESS,0,0,8,0.125,3,2,0,0,0,1,1,0,0,0,1,1,0,1,0,0,1,0,0,1,0,0
C-26/22 & C-64/22,2023-12-07,FIRST,4,A. Arabadjiev;T. von Danwitz;P.G. Xuereb;A. Kumin;I. Ziemele,5,A. Kumin,P. Pikamäe,1,47;48;49;50;51;52;53;54;55;56;57;58;59;60;61;62;63;64;65;66;67;68;69;70,24,"A supervisory authority decision on a complaint is subject to full judicial review, not merely procedural review of whether the complaint was handled.",Article 78(1);Article 77(1);Article 57(1)(f);Article 58,78;77;57;58,DPA_POWERS,REMEDIES_COMPENSATION,1,"That provision provides that, without prejudice to any other administrative or non-judicial remedy, each natural or legal person is to have the right to an effective judicial remedy against a legally binding decision of a supervisory authority concerning them.",1,"It is important to note that, in accordance with Article 8(3) of the Charter and Article 51(1) and Article 57(1)(a) of the GDPR, the national supervisory authorities are responsible for monitoring compliance with the EU rules concerning the protection of natural persons with regard to the processing of personal data.",1,"If Article 78(1) of that regulation were to be interpreted as meaning that the judicial review referred to therein is limited to verifying whether the supervisory authority has handled the complaint, investigated the subject matter of the complaint to the extent appropriate and informed the complainant of the outcome of the investigation, the attainment of the objectives and the pursuit of the purpose of the regulation would necessarily be compromised.",HIGH_LEVEL_OF_PROTECTION;EFFECTIVE_ENFORCEMENT,,TELEOLOGICAL,1,1,1,C-132/21;C-311/18,2,1,PRINCIPLE_BASED,0,PRO_DATA_SUBJECT,"Establishes full judicial review of DPA decisions, strengthening data subject remedies against inadequate supervisory authority responses.",0,NONE,0,NONE,0,,NONE,1,PRO_DATA_SUBJECT,2023,0.0,FIRST,ENFORCEMENT,0,1,4,0.25,3,3,0,0,0,1,0,1,0,0,1,0,0,0,0,1,1,0,0,1,0,0
C-26/22 & C-64/22,2023-12-07,FIRST,4,A. Arabadjiev;T. von Danwitz;P.G. Xuereb;A. Kumin;I. Ziemele,5,A. Kumin,P. Pikamäe,2,71;72;73;74;75;76;77;78;79;80;81;82;83;84;85;86;87;88;89;90;91;92;93;94;95;96;97;98;99;100;101;102;103;104;105,35,Credit agencies cannot retain insolvency discharge data beyond the public register retention period as this fails the legitimate interest balancing test.,Article 5(1)(a);Article 6(1)(f);Article 40,5;6;40,LEGITIMATE_INTERESTS,DATA_PROTECTION_PRINCIPLES,1,"Under that provision, the processing of personal data is lawful only if and to the extent that it is necessary for the purposes of the legitimate interests pursued by the controller or by a third party, except where such interests are overridden by the interests or fundamental rights and freedoms of the data subject which require protection of personal data.",1,"In that context, it should also be recalled that the condition relating to the need for processing must be examined in conjunction with the 'data minimisation' principle enshrined in Article 5(1)(c) of the GDPR, in accordance with which personal data must be 'adequate, relevant and limited to what is necessary in relation to the purposes for which they are processed'.",1,"Moreover, as the Advocate General observed in point 75 of his Opinion, the discharge from remaining debts is intended to allow the person who benefits from it to re-enter economic life and is therefore generally of existential importance to that person.",HIGH_LEVEL_OF_PROTECTION;FUNDAMENTAL_RIGHTS,,TELEOLOGICAL,1,1,1,C-252/21;C-13/16;C-77/21;C-131/12,4,1,RULE_BASED,0,PRO_DATA_SUBJECT,"Limits credit agency data retention to public register period, restricting controller processing and prioritizing data subject rehabilitation interests.",1,STRICT,1,DATA_SUBJECT,1,right to respect for private life;right to protection of personal data,DATA_PROTECTION,1,PRO_DATA_SUBJECT,2023,0.0,FIRST,LAWFULNESS,0,0,4,0.25,3,3,0,0,0,1,1,0,0,0,1,1,2,1,0,1,1,0,0,0,1,0
C-26/22 & C-64/22,2023-12-07,FIRST,4,A. Arabadjiev;T. von Danwitz;P.G. Xuereb;A. Kumin;I. Ziemele,5,A. Kumin,P. Pikamäe,3,106;107;109;110;111;112,6,Data subjects have the right to erasure when they object to processing and the controller cannot demonstrate overriding legitimate grounds.,Article 17(1)(c);Article 21(1),17;21,RIGHT_TO_ERASURE,RIGHT_TO_OBJECT,1,That provision establishes the right to erasure of personal data where the data subject objects to the processing pursuant to Article 21(1) of the GDPR and there are no 'overriding legitimate grounds for the processing'.,1,"It follows from a combined reading of those provisions that the data subject enjoys a right to object to processing and a right to erasure, unless there are overriding legitimate grounds which take precedence over the interests and rights and freedoms of that person within the meaning of Article 21(1) of the GDPR, which it is for the controller to demonstrate.",0,,,,SYSTEMATIC,1,1,0,,0,0,RULE_BASED,0,PRO_DATA_SUBJECT,Confirms erasure right when data subject objects and places burden on controller to demonstrate overriding legitimate grounds.,0,NONE,1,DATA_SUBJECT,0,,NONE,1,PRO_DATA_SUBJECT,2023,0.0,FIRST,RIGHTS,0,0,4,0.25,2,1,0,0,0,0,0,0,0,0,0,1,0,1,0,0,0,1,0,0,1,0
C-26/22 & C-64/22,2023-12-07,FIRST,4,A. Arabadjiev;T. von Danwitz;P.G. Xuereb;A. Kumin;I. Ziemele,5,A. Kumin,P. Pikamäe,4,106;107;108,3,Controllers must erase unlawfully processed personal data as soon as possible without undue delay.,Article 17(1)(d),17,RIGHT_TO_ERASURE,,1,"Under Article 17(1)(d) of the GDPR, to which the referring court refers, the data subject has the right to obtain from the controller the erasure of personal data concerning him or her without undue delay and the controller has the obligation to erase personal data without undue delay where the personal data have been unlawfully processed.",0,,0,,,,SEMANTIC,1,1,0,,0,0,RULE_BASED,0,PRO_DATA_SUBJECT,"Affirms immediate erasure obligation for unlawfully processed data, strengthening data subject remedies.",0,NONE,0,NONE,0,,NONE,1,PRO_DATA_SUBJECT,2023,0.0,FIRST,RIGHTS,0,0,4,0.25,1,1,0,0,0,0,0,0,0,0,0,0,0,0,0,0,0,0,1,0,1,0
C-268/21,2023-03-02,THIRD,2,K. Jürimäe;M.L. Arastey Sahún;N. Piçarra;N. Jääskinen;M. Gavalec,5,N. Jääskinen,T. Ćapeta,1,25;26;27;28;29;30;31;32;33;34;35;36;37;38;39;40;41,17,Article 6(3) and (4) GDPR applies to the production in civil court proceedings of documents containing personal data originally collected for other purposes such as tax inspection.,Article 6(3);Article 6(4);Article 23(1)(f);Article 23(1)(j),6;23,LEGAL_OBLIGATION_BASIS,PUBLIC_INTEREST_BASIS,1,"According to Article 4(2) of that regulation, the definition of 'processing' of personal data includes any operation which is performed on personal data, whether or not by automated means, such as collection, recording, use, disclosure by transmission, dissemination or otherwise making available.",1,"The combined provisions of Article 6(1)(e) of the GDPR and Article 6(3) thereof therefore require there to be a legal basis – national in particular – which serves as a basis for the processing of personal data by the relevant controllers acting in the performance of a task carried out in the public interest or in the exercise of official authority, such as those performed by courts acting in their judicial capacity.",1,"Those objectives include, in accordance with Article 23(1)(f) of that regulation, 'the protection of judicial independence and judicial proceedings', which, as the European Commission noted in its written observations, must be understood as referring to the protection of the administration of justice from internal or external interference, but also to the proper administration of justice.",LEGAL_CERTAINTY;EFFECTIVE_ENFORCEMENT,,SYSTEMATIC,1,1,1,C-245/20;C-342/12;C-180/21,3,0,RULE_BASED,0,NEUTRAL_OR_UNCLEAR,The holding clarifies the scope of GDPR application to civil proceedings without expanding or restricting rights of either party.,1,REGULAR,0,NONE,0,,NONE,0,INDETERMINATE,2023,0.0,THIRD,LAWFULNESS,0,0,2,0.5,3,2,0,0,0,0,0,1,0,0,0,1,1,0,0,1,0,1,0,0,1,0
C-268/21,2023-03-02,THIRD,2,K. Jürimäe;M.L. Arastey Sahún;N. Piçarra;N. Jääskinen;M. Gavalec,5,N. Jääskinen,T. Ćapeta,2,42;43;44;45;46;47;48;49;50;51;52;53;54;55;56;57;58;59,18,"When ordering document production containing personal data, national courts must balance data subject interests against other interests, applying proportionality and data minimisation principles.",Article 5;Article 5(1)(c);Article 6;Article 6(3);Article 6(4);Article 4(5),4;5;6,DATA_PROTECTION_PRINCIPLES,OTHER_CONTROLLER_OBLIGATIONS,1,"According to that data minimisation principle, personal data must be adequate, relevant and limited to what is necessary in relation to the purposes for which they are processed.",1,"Any processing of personal data must, subject to the derogations permitted in Article 23 thereof, observe the principles governing the processing of personal data and the rights of the person concerned set out, respectively, in Chapters II and III of that regulation.",1,"However, as recital 4 of the GDPR states, the right to the protection of personal data is not an absolute right, but must be considered in relation to its function in society and be balanced, in accordance with the principle of proportionality, against other fundamental rights, such as the right to effective judicial protection, guaranteed in Article 47 of the Charter.",HIGH_LEVEL_OF_PROTECTION;FUNDAMENTAL_RIGHTS,,TELEOLOGICAL,1,1,1,C-511/18;C-512/18;C-520/18;C-439/19,4,1,PRINCIPLE_BASED,1,PRO_DATA_SUBJECT,"Requires courts to actively consider data subject interests and apply data minimisation, including pseudonymisation and access restrictions, when ordering document production.",1,REGULAR,1,DATA_SUBJECT,1,right to effective judicial protection;right to a fair trial,NONE,1,PRO_DATA_SUBJECT,2023,0.0,THIRD,PRINCIPLES,0,0,2,0.5,3,3,0,0,0,1,1,0,0,0,1,1,1,1,0,1,1,0,0,1,0,0
C-272/19,2020-07-09,THIRD,1,A. Prechal;L.S. Rossi;J. Malenovský;F. Biltgen;N. Wahl,5,L.S. Rossi,M. Szpunar,1,63;64;65;66;67;68;69;70;71;72;73;74,12,A petitions committee of a federated state parliament that determines purposes and means of processing personal data is a controller under the GDPR.,Article 4(7);Article 2(2)(a);Article 15;Article 23,4;2;15;23,CONTROLLER_DEFINITION,SCOPE_MATERIAL,1,"Article 4(7) of that regulation defines the 'controller' as being the natural or legal person, public authority, agency or other body which, alone or jointly with others, determines the purposes and means of the processing of personal data.",1,"Since Article 2(2)(a) of that regulation constitutes an exception to the very wide definition of the scope of that regulation set out in Article 2(1) of that regulation, Article 2(2)(a) must be interpreted restrictively.",1,"That applies a fortiori with respect to Regulation 2016/679, which is based on Article 16 TFEU, which states that the European Parliament and the Council of the European Union are to lay down the rules relating to the protection of individuals with regard to the processing of personal data by, in particular, Member States when carrying out activities which fall within the scope of Union law, and the rules relating to the free movement of such data.",HIGH_LEVEL_OF_PROTECTION;HARMONIZATION,,SEMANTIC,1,1,1,C-101/01,1,0,RULE_BASED,0,PRO_DATA_SUBJECT,Broad interpretation of controller definition to include parliamentary committees expands GDPR scope and enables data subject access rights.,0,NONE,0,NONE,0,,NONE,1,PRO_DATA_SUBJECT,2020,-3.0,THIRD,ACTORS,0,0,1,1.0,3,2,0,0,0,1,0,0,1,0,1,0,0,0,0,1,0,0,1,0,1,0
C-300/21,2023-05-04,THIRD,3,K. Jürimäe;M. Safjan;N. Piçarra;N. Jääskinen;M. Gavalec,5,N. Jääskinen,M. Campos Sánchez-Bordona,1,28;29;30;31;32;33;34;35;36;37;38;39;40;41;42,15,The mere infringement of GDPR provisions is not sufficient to confer a right to compensation; actual damage must be proven.,Article 82(1);Article 82(2);Article 4(1),82;4,REMEDIES_COMPENSATION,,1,"It is clear from the wording of that provision that the existence of 'damage' which has been 'suffered' constitutes one of the conditions for the right to compensation laid down in that provision, as does the existence of an infringement of the GDPR and of a causal link between that damage and that infringement, those three conditions being cumulative.",1,"The relationship between the rules set out in Article 82 and those set out in Articles 83 and 84 shows that there is a difference between those two categories of provisions, but also complementarity, in terms of encouraging compliance with the GDPR.",0,,,,SEMANTIC,1,1,1,C-439/19;C-595/20;C-786/19;C-65/20,4,0,RULE_BASED,0,PRO_CONTROLLER,"Requires proof of actual damage beyond mere GDPR infringement, limiting compensation claims.",0,NONE,0,NONE,0,,NONE,0,PRO_CONTROLLER,2023,0.0,THIRD,ENFORCEMENT,1,0,3,0.3333333333333333,2,2,0,0,0,0,0,0,0,0,0,0,0,0,0,1,0,0,1,0,1,0
C-300/21,2023-05-04,THIRD,3,K. Jürimäe;M. Safjan;N. Piçarra;N. Jääskinen;M. Gavalec,5,N. Jääskinen,M. Campos Sánchez-Bordona,2,43;44;45;46;47;48;49;50;51,9,National rules cannot make compensation for non-material damage conditional on the damage reaching a certain threshold of seriousness.,Article 82(1),82,REMEDIES_COMPENSATION,,1,"Article 82 of that regulation confines itself to expressly stating that not only 'material damage' but also 'non-material damage' may give rise to a right to compensation, without any reference being made to any threshold of seriousness.",1,The third sentence of recital 146 of the GDPR states that 'the concept of damage should be broadly interpreted in the light of the case-law of the Court of Justice in a manner which fully reflects the objectives of this Regulation'.,1,"It would be contrary to that broad conception of 'damage', favoured by the EU legislature, if that concept were limited solely to damage of a certain degree of seriousness.",HIGH_LEVEL_OF_PROTECTION;HARMONIZATION,,TELEOLOGICAL,1,1,1,C-311/18;C-154/21,2,0,RULE_BASED,0,PRO_DATA_SUBJECT,Broad interpretation of damage concept prevents Member States from imposing seriousness thresholds that would limit compensation claims.,0,NONE,0,NONE,0,,NONE,1,PRO_DATA_SUBJECT,2023,0.0,THIRD,ENFORCEMENT,1,0,3,0.3333333333333333,3,2,0,0,0,1,0,0,1,0,1,0,0,0,0,1,1,0,0,0,1,0
C-300/21,2023-05-04,THIRD,3,K. Jürimäe;M. Safjan;N. Piçarra;N. Jääskinen;M. Gavalec,5,N. Jääskinen,M. Campos Sánchez-Bordona,3,52;53;54;55;56;57;58;59,8,"National courts apply domestic rules to determine damages amounts, subject to principles of equivalence and effectiveness ensuring full and effective compensation.",Article 82;Article 4(1),82;4,REMEDIES_COMPENSATION,MEMBER_STATE_DISCRETION,0,,1,"In the absence of EU rules on the matter, it is for the national legal order of each Member State to establish procedural rules for actions intended to safeguard the rights of individuals, in accordance with the principle of procedural autonomy.",1,"In that regard, in view of the compensatory function of the right to compensation under Article 82 of the GDPR, as the Advocate General pointed out, in essence, in points 39, 49 and 52 of his Opinion, financial compensation based on that provision must be regarded as 'full and effective' if it allows the damage actually suffered as a result of the infringement of that regulation to be compensated in its entirety, without there being any need, for the purposes of such compensation for the damage in its entirety, to require the payment of punitive damages.",EFFECTIVE_ENFORCEMENT,,SYSTEMATIC,1,1,1,C-403/16;C-18/21;C-295/04,3,0,RULE_BASED,0,MIXED,"Defers to national law on quantum but requires full and effective compensation, balancing procedural autonomy with data subject protection.",0,NONE,0,NONE,0,,NONE,0,INDETERMINATE,2023,0.0,THIRD,ENFORCEMENT,1,0,3,0.3333333333333333,2,2,0,0,0,0,0,1,0,0,0,0,0,0,0,1,0,1,0,0,1,0
